<?xml version="1.0"?>
<!DOCTYPE myks PUBLIC  "-//YKS//MYKS" "http://rsrcs.exyks.org/dtds/myks.dtd">
<myks>
  <table name="ks_myks_titles">
    <fields>
      <field type="myks_type" key="primary"/>
      <field type="myks_val" key="primary"/>
      <field type="lang_key" key="primary"/>
      <field type="trad"/>
    </fields>
  </table>
  <mykse type="trad">
    <string length="200"/>
  </mykse>
  <mykse type="myks_val">
    <string length="20"/>
  </mykse>
</myks>
