<?xml version="1.0"?>
<!DOCTYPE myks PUBLIC  "-//YKS//MYKS" "http://rsrcs.exyks.org/dtds/myks.dtd">
<myks>
  <table name="ks_auth_password">
    <fields>
      <field type="user_id" key="primary" update="cascade" delete="cascade"/>
      <field type="user_login" key="unique"/>
      <field type="user_pswd"/>
    </fields>
  </table>
  <mykse type="user_pswd">
    <mykse type="sha1"/>
  </mykse>
  <mykse type="user_login">
    <mykse type="user_name"/>
  </mykse>
</myks>
